"Trajectory Planning for Multi-UAV Assisted Wireless Networks in Post-Disaster Scenario","Y. Lin; T. Wang; S. Wang","Nanjing University; Nanjing University; Nanjing University","2019 IEEE Global Communications Conference (GLOBECOM)","","2019","","","1","6","","","","10.1109/GLOBECOM38437.2019.9014091","","https://ieeexplore.ieee.org/stamp/stamp.jsp?arnumber=https://ieeexplore.ieee.org/document/9014091","","Trajectory;Planning;Batteries;Wireless networks;Throughput;Base stations;Simulation","","","","","","","","","","IEEE","IEEE Conferences"
"Invariant Analysis for the Task Refinement of Workflow Nets","J. Ge; H. Hu; J. Lu","Nanjing University; Nanjing University; Nanjing University","2006 International Conference on Computational Inteligence for Modelling Control and Automation and International Conference on Intelligent Agents Web Technologies and International Commerce (CIMCA'06)","","2006","","","209","209","","","","10.1109/CIMCA.2006.135","","https://ieeexplore.ieee.org/stamp/stamp.jsp?arnumber=https://ieeexplore.ieee.org/document/4052825","workflow process model;workflow composition;task refinement;Petri nets;invariants;soundness","State-space methods;Petri nets;Explosions;Technology management;Computational intelligence;Laboratories;Software;Interconnected systems;Sufficient conditions;Space technology","Petri nets;task analysis;workflow management software","invariant analysis;task refinement;workflow nets;workflow system;workflow composition;Petri net","","2","","","","","","IEEE","IEEE Conferences"
"Age Estimation using Disconnectedness Features in Handwriting","V. Basavaraja; P. Shivakumara; D. S. Guru; U. Pal; T. Lu; M. Blumenstein","University of Mysore, India; University of Malaya, Kuala Lumpur; University of Mysore, India; Indian Statistical Institute, Kolkata; Nanjing University; University of Technology Sydney","2019 International Conference on Document Analysis and Recognition (ICDAR)","","2019","","","1131","1136","","","","10.1109/ICDAR.2019.00183","","https://ieeexplore.ieee.org/stamp/stamp.jsp?arnumber=https://ieeexplore.ieee.org/document/8978131","Hu moments, Invariant moments, Disconnnectedness, Age estimation, Handwriting analysis","Image edge detection;Estimation;Shape;Feature extraction;Writing;Mathematical model;Shape measurement","computer vision;edge detection;feature extraction;handwriting recognition;image recognition;pattern clustering;text analysis","disconnectedness features;real-time applications;handwriting analysis;forensic information security;human age estimation;immigrant checking;Hu invariant moments;intersection point detection;Canny edge images;input document;text components;text component pair;multishape components","","","","","","","","IEEE","IEEE Conferences"
"Similarity Analysis of Law Documents Based on Word2vec","C. Xia; T. He; W. Li; Z. Qin; Z. Zou","Nanjing University; Nanjing University; Nanjing University; Nanjing University; Nanjing University","2019 IEEE 19th International Conference on Software Quality, Reliability and Security Companion (QRS-C)","","2019","","","354","357","","","","10.1109/QRS-C.2019.00072","","https://ieeexplore.ieee.org/stamp/stamp.jsp?arnumber=https://ieeexplore.ieee.org/document/8859429","Deep learning;Intelligent justice;Word2vec;Law document corpus;Similarity analysis","Law;Data models;Text analysis;Natural language processing;Predictive models;Bars;Shape","document handling;law;learning (artificial intelligence);natural language processing","similarity analysis;intelligent justice;Word2vec model;equipped law documents corpus;computer-assisted wisdom;deep learning;legal document corpus;bag of words model","","","","","","","","IEEE","IEEE Conferences"
"Neural Adaptive Transport Framework for Internet-scale Interactive Media Streaming Services","Y. Xu; H. Chen; Y. Zhao; W. Zhang; Q. Shen; X. Zhang; Z. Ma","Shanghai Jiao Tong University; Shanghai Jiao Tong University; Nanjing University; Shanghai Jiao Tong University; Nanjing University; Nanjing University; Nanjing University","2019 IEEE International Symposium on Broadband Multimedia Systems and Broadcasting (BMSB)","","2019","","","1","6","","","","10.1109/BMSB47279.2019.8971955","","https://ieeexplore.ieee.org/stamp/stamp.jsp?arnumber=https://ieeexplore.ieee.org/document/8971955","Overlay routing;resolution scaling;adaptive real-time streaming;neural adaptive transport","","cloud computing;Internet;learning (artificial intelligence);neural nets;quality of experience;telecommunication network routing;video signal processing;video streaming","neural adaptive transport framework;Internet-scale interactive media streaming services;network dynamics;bandwidth fluctuation;learned resolution scaling;deep reinforcement learning;maximal QoE;quality of experience;media services;NAT system;learning based cloud overlay routing scheme;COR scheme;minimal end-to-end latency;residual neural network based collaborative video processing system;CVP system;adaptive real-time streaming strategy;ARS strategy;QoE improvement;video bitrate","","","","","","","","IEEE","IEEE Conferences"
"One more queue is enough: Minimizing flow completion time with explicit priority notification","Y. Lu; G. Chen; L. Luo; K. Tan; Y. Xiong; X. Wang; E. Chen","University of Science and Technology of China; Microsoft; Microsoft; Microsoft; Microsoft; Nanjing University; University of Science and Technology of China","IEEE INFOCOM 2017 - IEEE Conference on Computer Communications","","2017","","","1","9","","","","10.1109/INFOCOM.2017.8056946","","https://ieeexplore.ieee.org/stamp/stamp.jsp?arnumber=https://ieeexplore.ieee.org/document/8056946","","Switches;Hardware;Processor scheduling;Dynamic scheduling;Conferences;Bandwidth","computer centres;packet switching;queueing theory;scheduling;telecommunication traffic;transport protocols","scheduling mechanism;switch priority queues;flow scheduling;TCP;clean-slate switch hardware;commodity switches;flow size information;fine-grained priorities;EPN;flow completion time;queue","","7","","","","","","IEEE","IEEE Conferences"
"Online Power Allocation for Sum Rate Maximization in TDD Massive MIMO Systems","M. Li; T. Wang; S. Wang","Nanjing University; Nanjing University; Nanjing University","2019 IEEE Global Communications Conference (GLOBECOM)","","2019","","","1","6","","","","10.1109/GLOBECOM38437.2019.9013781","","https://ieeexplore.ieee.org/stamp/stamp.jsp?arnumber=https://ieeexplore.ieee.org/document/9013781","","Resource management;Downlink;MIMO communication;Optimization;Computational complexity;Base stations;Uplink","","","","","","","","","","IEEE","IEEE Conferences"
"Traffic Measurement Optimization Based on Reinforcement Learning in Large-Scale IP Backbone Networks","H. Wang; L. Nie; Z. Ning; M. S. Obaidat; R. Shang","Northwestern Polytechnical University; Northwestern Polytechnical University; Nanjing University; Nazarbayev University; Northwestern Polytechnical University","2019 IEEE Global Communications Conference (GLOBECOM)","","2019","","","1","6","","","","10.1109/GLOBECOM38437.2019.9013788","","https://ieeexplore.ieee.org/stamp/stamp.jsp?arnumber=https://ieeexplore.ieee.org/document/9013788","","Learning (artificial intelligence);Optimization;Routing;IP networks;Tomography;Monitoring;Estimation","","","","","","","","","","IEEE","IEEE Conferences"
"QoE-ensured price competition model for emerging mobile networks","M. Dong; X. Liu; Z. Qian; A. Liu; T. Wang","Muroran Institute of Technology; Central South University; Nanjing University; Central South University; Hunan University","IEEE Wireless Communications","","2015","22","4","50","57","","","","10.1109/MWC.2015.7224727","","https://ieeexplore.ieee.org/stamp/stamp.jsp?arnumber=https://ieeexplore.ieee.org/document/7224727","","Mobile communication;Mobile computing;Quality of service;Pricing;Smart phones","game theory;mobile computing;quality of experience","QoE-ensured price competition model;mobile networks;ubiquitous availability;data collection methods;price competition;game theory model;social behavior;evolutionary relationship","","54","","","","","","IEEE","IEEE Conferences"
"FADBM: Frequency-Aware Dummy-Based Method in Long-Term Location Privacy Protection","J. Liu; X. Jiang; S. Zhang; H. Wang; W. Dou","Nanjing University; Nanjing University; Nanjing University; Norwegian University of Science and Technology; Nanjing University","2019 IEEE 25th International Conference on Parallel and Distributed Systems (ICPADS)","","2019","","","384","391","","","","10.1109/ICPADS47876.2019.00060","","https://ieeexplore.ieee.org/stamp/stamp.jsp?arnumber=https://ieeexplore.ieee.org/document/8975879","privacy protection, location-based services, k-anonymity, dummy generation, trajectory privacy","","data privacy;location based services;query processing","FADBM;long-term location privacy protection;location-based services;continuous queries;dummy frequent regions;frequency-aware dummy-based method","","","","","","","","IEEE","IEEE Conferences"
"Single-input-multiple-ouput transcoding for video streaming","C. Wang; B. Li; J. Wang; H. Zhang; H. Chen; Y. Xu; Z. Ma","Shanghai Jiaotong University; Shanghai Jiaotong University; Central South University; Central South University; Shanghai Jiaotong University; Shanghai Jiaotong University; Nanjing University","2016 IEEE 18th International Workshop on Multimedia Signal Processing (MMSP)","","2016","","","1","5","","","","10.1109/MMSP.2016.7813357","","https://ieeexplore.ieee.org/stamp/stamp.jsp?arnumber=https://ieeexplore.ieee.org/document/7813357","Transcoding;bit rate shaping;HEVC","Transcoding;Bit rate;Streaming media;Complexity theory;Spatial resolution;Transform coding","transcoding;video coding;video streaming","single input multiple ouput transcoding;video streaming;multiple output transcoding;HTTP live streaming","","3","","","","","","IEEE","IEEE Conferences"
"Quality Measurement of Judgment Documents","J. Liu; Z. Wang; G. Yan; H. Lian","Jinling Institute of Technology; missing; Nanjing University; Nanjing University","2019 IEEE 19th International Conference on Software Quality, Reliability and Security Companion (QRS-C)","","2019","","","296","299","","","","10.1109/QRS-C.2019.00063","","https://ieeexplore.ieee.org/stamp/stamp.jsp?arnumber=https://ieeexplore.ieee.org/document/8859436","Judicial Documents, Data Quality, Unstructured Data, Natural Language Understanding","Natural languages;Dictionaries;Vocabulary;Measurement;Data integrity;Decision making;Law","quality management;text analysis","unstructured text data;adjudication documents;quality metrics;quality measurement;judgment documents","","","","","","","","IEEE","IEEE Conferences"
"Law Article Prediction Based on Deep Learning","G. Yan; Y. Li; S. Shen; S. Zhang; J. Liu","Nanjing University; Nanjing University; Nanjing University; Nanjing University; Nanjing University","2019 IEEE 19th International Conference on Software Quality, Reliability and Security Companion (QRS-C)","","2019","","","281","284","","","","10.1109/QRS-C.2019.00060","","https://ieeexplore.ieee.org/stamp/stamp.jsp?arnumber=https://ieeexplore.ieee.org/document/8859437","Law Articles Prediction, Multi-label Classification, TextCNN","Law;Feature extraction;Task analysis;Deep learning;Predictive models","convolutional neural nets;feature extraction;law administration;learning (artificial intelligence);pattern classification;text analysis;word processing","deep learning;judicial documents;legal intelligence;multilabel classification problem;word segmentation;feature extraction;TextCNN;law article prediction;legal knowledge comprehension;law articles","","","","","","","","IEEE","IEEE Conferences"
"A Middleware Approach for Behavior Consistent Composition of Services in Smart Space","Q. Yin; H. Hu; J. Li; J. Lu","Nanjing University; Nanjing University; Nanjing University; Nanjing University","IEEE International Conference on Service-Oriented Computing and Applications (SOCA '07)","","2007","","","233","240","","","","10.1109/SOCA.2007.4","","https://ieeexplore.ieee.org/stamp/stamp.jsp?arnumber=https://ieeexplore.ieee.org/document/4273431","","Middleware;Space technology;Pervasive computing;Application software;Unified modeling language;Context-aware services;Quality of service;Distributed computing;Cameras;Laboratories","middleware;ubiquitous computing;Unified Modeling Language;Web services","middleware;smart space services;service-oriented computing;pervasive computing;service-oriented technologies;heterogeneous service components;service specifications;UML activity diagrams","","","","","","","","IEEE","IEEE Conferences"
"HyMJ: A Hybrid Structure-Aware Approach to Distributed Multi-way Join Query","G. Zhu; X. Wu; L. Yin; H. Wang; R. Gu; C. Yuan; Y. Huang","Nanjing University; Nanjing University; Nanjing University; Nanjing University; Nanjing University; Nanjing University; Nanjing University","2019 IEEE 35th International Conference on Data Engineering (ICDE)","","2019","","","1726","1729","","","","10.1109/ICDE.2019.00183","","https://ieeexplore.ieee.org/stamp/stamp.jsp?arnumber=https://ieeexplore.ieee.org/document/8731349","multi-way join;distributed computing;parallel query;Apache Spark","Hypercubes;Tin;Cluster computing;Data mining;Twitter;Proteins;Software","Big Data;data analysis;query processing;trees (mathematics)","HyMJ;big data analytic scenarios;multiround algorithms;query structure graph;internal query structure;query structure decomposition tree;QSDT;structure-aware query plan;cyclic query structure;acyclic query structure;distributed multiway join query;one round algorithms;hybrid structure-aware multiway join algorithm;graph contraction based algorithm;QSG","","","","","","","","IEEE","IEEE Conferences"
"TIE: Energy-efficient Tensor Train-based Inference Engine for Deep Neural Network","C. Deng; F. Sun; X. Qian; J. Lin; Z. Wang; B. Yuan","Rutgers University; Nanjing University; University of Southern California; Nanjing University; Nanjing University; Rutgers University","2019 ACM/IEEE 46th Annual International Symposium on Computer Architecture (ISCA)","","2019","","","264","277","","","","","","https://ieeexplore.ieee.org/stamp/stamp.jsp?arnumber=https://ieeexplore.ieee.org/document/8980328","Deep learning;tensor-train decomposition;compression;acceleration","","artificial intelligence;CMOS memory circuits;electronic engineering computing;energy conservation;inference mechanisms;low-power electronics;multiprocessing systems;neural nets;parallel processing;tensors","TT-format DNN models;redundant computations;energy consumption;TT decomposition;computation-efficient inference scheme;energy saving;TT-format compressed DNN-targeted inference engine;energy efficiency;deep neural networks;DNN;model compression;tensor train decomposition;compression technique;energy-efficient tensor train;artificial intelligence;CMOS technology;power 154.8 mW;size 28.0 nm;frequency 1000.0 MHz","","","","","","","","IEEE","IEEE Conferences"
"Judicial Knowledge Reasoning Based on Representation Learning","B. Chen; Z. Li; S. Shen; Z. Zou; T. He","Information Center of The Supreme People's Court of The People's Republic of China; Nanjing University; Nanjing University; Nanjing University; Nanjing University","2019 IEEE 19th International Conference on Software Quality, Reliability and Security Companion (QRS-C)","","2019","","","84","88","","","","10.1109/QRS-C.2019.00029","","https://ieeexplore.ieee.org/stamp/stamp.jsp?arnumber=https://ieeexplore.ieee.org/document/8859419","judicial documents;representation learning;knowledge reasoning","Knowledge based systems;Semantics;Hidden Markov models;Cognition;Neurons;XML;Predictive models","case-based reasoning;inference mechanisms;law administration;learning (artificial intelligence);XML","representation learning;judicial knowledge reasoning model;judicial judgment documents;xml format;judicial documents;specific relationship;judgment document data;judicial knowledge base;judicial staff;writing judgment documents","","","","","","","","IEEE","IEEE Conferences"
"An Exploratory Study on Judicial Image Quality Assessment Based on Deep Learning","Q. Gu; W. Cai; S. Yu; Z. Chen","Nanjing University; Nanjing University; Nanjing University; Nanjing University","2019 IEEE 19th International Conference on Software Quality, Reliability and Security (QRS)","","2019","","","300","305","","","","10.1109/QRS.2019.00046","","https://ieeexplore.ieee.org/stamp/stamp.jsp?arnumber=https://ieeexplore.ieee.org/document/8854694","Image Quality Assessment, Judicial Image, Deep Learning","Image quality;Feature extraction;Deep learning;Agriculture;Distortion;Training;Convolutional neural networks","feature extraction;law administration;learning (artificial intelligence);neural nets","judicial image quality assessment;deep learning;judicial area;judicial applications;image features;judicial images;pretrained convolutional neural network models;image processing technique","","","","","","","","IEEE","IEEE Conferences"
"GAB: Graph Augmented Bayes Classifier","C. Jiao; J. Sun; C. Wang; M. Xu","Nanjing University; Nanjing University; Nanjing University; Nanjing University","Fourth International Conference on Fuzzy Systems and Knowledge Discovery (FSKD 2007)","","2007","1","","608","612","","","","10.1109/FSKD.2007.340","","https://ieeexplore.ieee.org/stamp/stamp.jsp?arnumber=https://ieeexplore.ieee.org/document/4405996","","Bayesian methods;Probability;Classification tree analysis;Sun;Laboratories;Frequency;Classification algorithms;Training data;Learning systems;Equations","Bayes methods;graph theory;pattern classification","graph augmented Bayes classifier;classification approach;naive Bayes classifier;conditional independence assumption;nonlinearly separable concepts","","","","","","","","IEEE","IEEE Conferences"
"Studies of Faraday magnetic rotation characteristics of polyaniline film","R. Yuan; W. Wu; Y. Wang; H. Qin; G. Wang; Z. Chen; X. Shen","Nanjing University; ; ; ; ; ; ","International Conference on Science and Technology of Synthetic Metals","","1994","","","70","70","","","","10.1109/STSM.1994.834754","","https://ieeexplore.ieee.org/stamp/stamp.jsp?arnumber=https://ieeexplore.ieee.org/document/834754","","Magnetic films","","","","","","","","","","IEEE","IEEE Conferences"
"On Virtual Network Embedding: Paths and Cycles","H. Wu; F. Zhou; Y. Chen; R. Zhang","Nanjing University; LISITE lab of the Institut Supérieur d’Électronique de Paris; Nanjing University; Shanghai University of Finance and Economics","2019 IEEE 27th International Symposium on Modeling, Analysis, and Simulation of Computer and Telecommunication Systems (MASCOTS)","","2019","","","179","188","","","","10.1109/MASCOTS.2019.00027","","https://ieeexplore.ieee.org/stamp/stamp.jsp?arnumber=https://ieeexplore.ieee.org/document/8843030","Virtual Network Embedding (VNE);Path and Cycles Embeddings;Algorithm Design","Substrates;Topology;Network topology;Bandwidth;Erbium;Virtualization;Indium phosphide","computational complexity;computer networks;directed graphs;knapsack problems;network theory (graphs);optimisation;telecommunication network topology;virtualisation","polynomial-time algorithm;WDAG;weighted directed auxiliary graph;MDKP;NP-hard problem;virtual network requests;generic embedding algorithms;least-resourceconsuming embedding;MultiDimensional Knapsack Problem;Multiple Knapsack Problem;path embedding;cycle embedding;general VNE problem;cycle embeddings;topological characteristics;topological heterogeneity;shared substrate network;VNR;Virtual Network Embedding problem;network virtualization","","","","","","","","IEEE","IEEE Conferences"
"Branch Use in Practice: A Large-Scale Empirical Study of 2,923 Projects on GitHub","W. Zou; W. Zhang; X. Xia; R. Holmes; Z. Chen","Nanjing University; Nanjing University; Monash University; University of British Columbia; Nanjing University","2019 IEEE 19th International Conference on Software Quality, Reliability and Security (QRS)","","2019","","","306","317","","","","10.1109/QRS.2019.00047","","https://ieeexplore.ieee.org/stamp/stamp.jsp?arnumber=https://ieeexplore.ieee.org/document/8854734","branch use;GitHub;exploratory study","Productivity;Software;Computer bugs;Task analysis;Collaboration;Control systems;Encoding","project management;public domain software;software development management","branch use;branch usage;branch analysis;GitHub;large-scale empirical study;open source software systems;OSS systems","","","","","","","","IEEE","IEEE Conferences"
"Data Consistency for Cooperative Caching in Mobile Environments","J. Cao; Y. Zhang; G. Cao; L. Xie","Hong Kong Polytechnic University; The Pennsylvania State University; The Pennsylvania State University; Nanjing University","Computer","","2007","40","4","60","66","","","","10.1109/MC.2007.123","","https://ieeexplore.ieee.org/stamp/stamp.jsp?arnumber=https://ieeexplore.ieee.org/document/4160225","data management;cache consistency protocol;mobile computing","Cooperative caching;Peer to peer computing;Protective relaying;Relays;Wireless networks;Optical wavelength conversion;Spread spectrum communication","cache storage;mobile computing;mobile radio;peer-to-peer computing","ubiquitous computing;Internet;data consistency;mobile wireless environment;relay-peer-based cache consistency protocol;cooperative caching","","49","","","","","","IEEE","IEEE Conferences"
"Modeling the Perceptual Impact of Viewport Adaptation for Immersive Video","S. Xie; Y. Xu; Q. Qian; Q. Shen; Z. Ma; W. Zhang","Shanghai Jiao Tong University; Shanghai Jiao Tong University; Nanjing University; Nanjing University; Nanjing University; Shanghai Jiao Tong University","2018 IEEE International Symposium on Circuits and Systems (ISCAS)","","2018","","","1","5","","","","10.1109/ISCAS.2018.8350961","","https://ieeexplore.ieee.org/stamp/stamp.jsp?arnumber=https://ieeexplore.ieee.org/document/8350961","Viewport (FoV) adaptation;Refinement duration;Quantization stepsize;Spatial resolution","Spatial resolution;Streaming media;Adaptation models;Quantization (signal);Analytical models;Navigation;Correlation","correlation methods;image representation;image resolution;video streaming","high-quality content;degraded-quality representation;network bandwidth consumption;spatial resolution;closed-form exponential functions;bandwidth-quality optimized immersive video streaming;virtualized environment;FoV adaptive streaming;viewport adaptation perceptual impact;field of view adaptive streaming;quantization","","1","","","","","","IEEE","IEEE Conferences"
"On video source format of screen content compression","X. Feng; F. Yang; H. Zhang; N. Shi; Z. Ma","Chongqing University of Technology; Chongqing University of Technology; Central South University; Nanjing University; Nanjing University","2015 Visual Communications and Image Processing (VCIP)","","2015","","","1","4","","","","10.1109/VCIP.2015.7457932","","https://ieeexplore.ieee.org/stamp/stamp.jsp?arnumber=https://ieeexplore.ieee.org/document/7457932","Color space;chroma sampling;screen content compression;HEVC","Bit rate;Encoding;Color;Codecs;Distortion;Artificial intelligence;Robots","image colour analysis;video coding","video source format;screen content compression;coding efficiency;coding complexity;high-efficiency video coding;HEVC;chroma sampling;subjective distortion estimation;mean opinion score;structural similarity;bit rate","","1","","","","","","IEEE","IEEE Conferences"
"Influence Of Heat Treatment On Magnetic And Structural Properties Of Garnet Films","B. Gu; H. Zhang; H. Zhai; M. Lu; S. Zhang; Y. Miao; S. Zhang","Nanjing University; ; ; ; ; ; ","1993 IEEE International Magnetics Conference (INTERMAG)","","1993","","","HR","HR","","","","10.1109/INTMAG.1993.642809","","https://ieeexplore.ieee.org/stamp/stamp.jsp?arnumber=https://ieeexplore.ieee.org/document/642809","","Heat treatment;Magnetic properties;Garnet films;Annealing;Temperature dependence;Magnetization","","","","","","","","","","IEEE","IEEE Conferences"
"Multi-granularity Position-Aware Convolutional Memory Network for Aspect-Based Sentiment Analysis","Y. Pan; J. Gan; X. Ran; C. Wang","Nanjing University; Nanjing University; Nanjing University; Nanjing University","2019 IEEE 31st International Conference on Tools with Artificial Intelligence (ICTAI)","","2019","","","728","735","","","","10.1109/ICTAI.2019.00106","","https://ieeexplore.ieee.org/stamp/stamp.jsp?arnumber=https://ieeexplore.ieee.org/document/8995220","Attention mechanism, Aspect-based sentiment analysis, Memory network, Convolutional neural network","","convolutional neural nets;data mining;feature extraction;learning (artificial intelligence);sentiment analysis","aspect information;position information;aspect-based sentiment analysis;fine-grained sentiment analysis problem;convolutional neural networks;MP-CMN;multiple convolutional layers;multigranularity position-aware convolutional memory network;attention mechanism;standard SemEval 2014 datasets","","","","","","","","IEEE","IEEE Conferences"
"Fast intra mode decision and block matching for HEVC screen content compression","H. Zhang; Q. Zhou; N. Shi; F. Yang; X. Feng; Z. Ma","Central South University; Central South University; Nanjing University; Chongqing University of Technology; Chongqing University of Technology; Nanjing University","2016 IEEE International Conference on Acoustics, Speech and Signal Processing (ICASSP)","","2016","","","1377","1381","","","","10.1109/ICASSP.2016.7471902","","https://ieeexplore.ieee.org/stamp/stamp.jsp?arnumber=https://ieeexplore.ieee.org/document/7471902","Intra mode;intra block copy;screen content coding;HEVC","Encoding;Complexity theory;Image color analysis;Estimation;Correlation","video coding","fast intra mode decision;block matching;HEVC screen content compression;screen content coding;high-efficiency video coding;screen content video;temporal correlation;coding units","","14","","","","","","IEEE","IEEE Conferences"
