"BigSpa: An Efficient Interprocedural Static Analysis Engine in the Cloud","Z. Zuo; R. Gu; X. Jiang; Z. Wang; Y. Huang; L. Wang; X. Li","Nanjing University; Nanjing University; Nanjing University; Nanjing University; Nanjing University; Nanjing University; Nanjing University","2019 IEEE International Parallel and Distributed Processing Symposium (IPDPS)","","2019","","","771","780","","","","10.1109/IPDPS.2019.00086","","https://ieeexplore.ieee.org/stamp/stamp.jsp?arnumber=https://ieeexplore.ieee.org/document/8820963","static analysis;mapreduce;data parallel computation","","Big Data;cloud computing;parallel algorithms;program diagnostics;reachability analysis","cluster scales;static program analysis;large-scale modern software;data-parallel algorithm;join-process-filter computation model;CFL-reachability based interprocedural analysis;BigSpa;interprocedural static analysis engine;big data solution;distributed static analysis engine;cloud computing","","","","","","","","IEEE","IEEE Conferences"
"Efficient Rate Adaptation for 802.11af TVWS Vehicular Access via Deep Learning","W. Xu; C. Ma; S. Guo; H. Zhou","The Hong Kong Polytechnic University; Wuhan University; The Hong Kong Polytechnic University; Nanjing University","2019 IEEE Global Communications Conference (GLOBECOM)","","2019","","","1","6","","","","10.1109/GLOBECOM38437.2019.9014062","","https://ieeexplore.ieee.org/stamp/stamp.jsp?arnumber=https://ieeexplore.ieee.org/document/9014062","","Time series analysis;Machine learning;Signal to noise ratio;Roads;Throughput;Wireless communication;Transceivers","","","","","","","","","","IEEE","IEEE Conferences"
"Exploring Communities in Large Profiled Graphs (Extended Abstract)","Y. Chen; Y. Fang; R. Cheng; Y. Li; X. Chen; J. Zhang","The University of Hong Kong; The University of Hong Kong; The University of Hong Kong; Nanjing University; Shenzhen University; Nanyang Technological University","2019 IEEE 35th International Conference on Data Engineering (ICDE)","","2019","","","2159","2160","","","","10.1109/ICDE.2019.00274","","https://ieeexplore.ieee.org/stamp/stamp.jsp?arnumber=https://ieeexplore.ieee.org/document/8731531","community search;social networks;graph queries;profiled graph","Indexes;Artificial intelligence;Collaboration;Flickr;Search problems;Biology;Semantics","social network theory;trees (mathematics)","profiled graph;community search problem;social networks;biological networks;PCS;high-quality diverse communities;profiled community search;tree index","","","","","","","","IEEE","IEEE Conferences"
"Near Optimal Charging Scheduling for 3-D Wireless Rechargeable Sensor Networks with Energy Constraints","C. Lin; C. Guo; H. Dai; L. Wang; G. Wu","Dalian University of Technology; Dalian University of Technology; Nanjing University; Dalian University of Technology; Dalian University of Technology","2019 IEEE 39th International Conference on Distributed Computing Systems (ICDCS)","","2019","","","624","633","","","","10.1109/ICDCS.2019.00068","","https://ieeexplore.ieee.org/stamp/stamp.jsp?arnumber=https://ieeexplore.ieee.org/document/8885113","3-D WRSN, Spatial and Temporal Discretization, Approximation Algorithm, Submodular Optimization","Wireless sensor networks;Approximation algorithms;Upper bound;Scheduling;Transmitters;Wireless communication;Software","approximation theory;autonomous aerial vehicles;inductive power transmission;optimisation;scheduling;wireless sensor networks","finite feasible charging spot;UAV;temporal discretization scheme;submodular maximization problem;routing constraints;optimal charging scheduling;3-D wireless rechargeable sensor networks;energy constraints;wireless power transfer technology;mobile chargers;unmanned aerial vehicle;charged energy;spatial discretization scheme;2-D networks;3-D WRSN;3-D environment;cost-efficient approximation algorithm","","","","","","","","IEEE","IEEE Conferences"
"RENN: Efficient Reverse Execution with Neural-Network-Assisted Alias Analysis","D. Mu; W. Guo; A. Cuevas; Y. Chen; J. Gai; X. Xing; B. Mao; C. Song","Nanjing University; The Pennsylvania State University; The Pennsylvania State University; The Pennsylvania State University; The Pennsylvania State University; The Pennsylvania State University; Nanjing University; UC Riverside","2019 34th IEEE/ACM International Conference on Automated Software Engineering (ASE)","","2019","","","924","935","","","","10.1109/ASE.2019.00090","","https://ieeexplore.ieee.org/stamp/stamp.jsp?arnumber=https://ieeexplore.ieee.org/document/8952186","Reverse Execution, Deep Learning, Memory Alias","","binary codes;computational complexity;learning (artificial intelligence);program debugging;program diagnostics;recurrent neural nets;storage management;system recovery","RENN;efficient reverse execution;neural-network-assisted alias analysis;coredump analysis;software crashes;memory aliases;hypothesis testing;high computational complexity;deep neural architecture;memory alias resolution;recurrent neural network;binary code pattern;memory accesses;memory region;memory references;nonalias relation;deep learning;binary analysis tasks;off-the-shelf neural networks;recurrent neural architecture;machine code segments;memory corruption vulnerabilities;faster execution time","","","","","","","","IEEE","IEEE Conferences"
"Virtual Reality in the Digital Olympic Museum","Z. Pan; W. Chen; M. Zhang; J. Liu; G. Wu","Zhejiang University; Zhejiang University; Zhejiang University; Zhejiang University; Nanjing University","IEEE Computer Graphics and Applications","","2009","29","5","91","95","","","","10.1109/MCG.2009.103","","https://ieeexplore.ieee.org/stamp/stamp.jsp?arnumber=https://ieeexplore.ieee.org/document/5230471","digital museum;Olympics;virtual environment;sports simulation;virtual reality","Virtual reality;Animation;Information retrieval;Avatars;Navigation;Large-scale systems;Virtual environment;History","avatars;computer animation;exhibitions;human computer interaction;humanities;information retrieval;sport","virtual reality;digital Olympic museum;cross-media information retrieval;distributed 3D virtual environment;Olympics history;Olympics culture","","12","","","","","","IEEE","IEEE Conferences"
"A methodology for analyzing availability weak points in SOA deployment frameworks","J. Luo; Y. Li; J. A. Pershing; L. Xie; Y. Chen","IBM China Research Lab; IBM China Research Lab; IBM T.J. Watson Research Center; Nanjing University; IBM China Research Lab","IEEE Transactions on Network and Service Management","","2009","6","1","31","44","","","","10.1109/TNSM.2009.090303","","https://ieeexplore.ieee.org/stamp/stamp.jsp?arnumber=https://ieeexplore.ieee.org/document/5331279","Availability, SOA, workflow analysis, deployment optimization.","Availability;Semiconductor optical amplifiers;Service oriented architecture;Quality of service;Costs;Prototypes;Performance analysis;Delay;Topology","business data processing;software architecture;workflow management software","availability weak points;SOA deployment framework;business IT system;quality of service;SOA environment;IT resource;workflow;high availability enhancement recommendation;business-level availability requirement;IBM;service oriented architecture","","10","","","","","","IEEE","IEEE Conferences"
"Automatic Self-Validation for Code Coverage Profilers","Y. Yang; Y. Jiang; Z. Zuo; Y. Wang; H. Sun; H. Lu; Y. Zhou; B. Xu","Nanjing University; Nanjing University; Nanjing University; Nanjing University; Nanjing University; Nanjing University; Nanjing University; Nanjing University","2019 34th IEEE/ACM International Conference on Automated Software Engineering (ASE)","","2019","","","79","90","","","","10.1109/ASE.2019.00018","","https://ieeexplore.ieee.org/stamp/stamp.jsp?arnumber=https://ieeexplore.ieee.org/document/8952463","Code coverage, Metamorphic testing, Coverage profilers, Bug detection.","","dynamic programming;program compilers;program debugging;program diagnostics;program testing;reverse engineering;software engineering","code coverage profilers;primitive dynamic program behavior information;software engineering tasks;testing oracle problem;test program;compiler;profiler bugs;coverage statistics","","","","","","","","IEEE","IEEE Conferences"
"Timed Data Plane Update in Data Center Network","Y. Liu; X. Gao; J. Zheng; G. Chen","Shanghai Jiao Tong University; Shanghai Jiao Tong University; Nanjing University; Shanghai Jiao Tong University","2019 IEEE 25th International Conference on Parallel and Distributed Systems (ICPADS)","","2019","","","117","124","","","","10.1109/ICPADS47876.2019.00024","","https://ieeexplore.ieee.org/stamp/stamp.jsp?arnumber=https://ieeexplore.ieee.org/document/8975807","data plane update, datacenter network, SDN, schedule, flow update","","computer centres;graph theory;software defined networking;synchronisation;telecommunication congestion control;telecommunication scheduling","timed data plane update;data center network;software-defined networks;SDN control plane;decoupled control;switch-operation level dependency graph;fast update scheduling;TIDERS algorithm;flow-based dependency graph","","","","","","","","IEEE","IEEE Conferences"
"CRNN Based Jersey-Bib Number/Text Recognition in Sports and Marathon Images","S. Nag; R. Ramachandra; P. Shivakumara; U. Pal; T. Lu; M. Kankanhalli","Kalyani Government Engineering College, India; Norwegian University of Science and Technology; University of Malaya, Malaysia; Indian Statistical Institute, Kolkata; Nanjing University; National University of Singapore","2019 International Conference on Document Analysis and Recognition (ICDAR)","","2019","","","1149","1156","","","","10.1109/ICDAR.2019.00186","","https://ieeexplore.ieee.org/stamp/stamp.jsp?arnumber=https://ieeexplore.ieee.org/document/8977968","Text detection;Text recognition;Jersey number recognition;Bib number recognition","Text recognition;Sports;Image recognition;Hip;Thigh;Torso;Biological system modeling","convolutional neural nets;feature extraction;object detection;recurrent neural nets;sport;text detection","sports images;marathon images;cluttered environment conditions;Single Shot Multibox Detector;CNN-RNN based deep model;CRNN;text detection;jersey-bib number/text recognition","","","","","","","","IEEE","IEEE Conferences"
"Heterogeneity-aware Gradient Coding for Straggler Tolerance","H. Wang; S. Guo; B. Tang; R. Li; C. Li","Huazhong University of Science and Technology; Huazhong University of Science and Technology; Nanjing University; Huazhong University of Science and Technology; Huazhong University of Science and Technology","2019 IEEE 39th International Conference on Distributed Computing Systems (ICDCS)","","2019","","","555","564","","","","10.1109/ICDCS.2019.00062","","https://ieeexplore.ieee.org/stamp/stamp.jsp?arnumber=https://ieeexplore.ieee.org/document/8885332","Modern distributed system, straggler tolerance, gradient coding, heterogeneity-aware","Encoding;Task analysis;Decoding;Computational modeling;Distributed databases;Machine learning algorithms;Optimization","cloud computing;gradient methods;image classification;image coding;learning (artificial intelligence);optimisation;pattern clustering;resource allocation","distributed computing;multiple workers;partial data;master node aggregates;straggler workers;coding-based approaches;straggler problem;computation capabilities;modern distributed systems;novel heterogeneity-aware gradient coding scheme;heterogenous workers;gradient descent based image classification;computation time;state-of-the-art coding scheme;straggler tolerance;gradient descent algorithms;machine learning","","","","","","","","IEEE","IEEE Conferences"
"A Tight Lower Bound for Relaxed Loop-Free Updates in SDNs","H. Zhou; X. Gao; J. Zheng; G. Chen","Shanghai Jiao Tong University; Shanghai Jiao Tong University; Nanjing University; Shanghai Jiao Tong University","2019 IEEE 39th International Conference on Distributed Computing Systems (ICDCS)","","2019","","","91","100","","","","10.1109/ICDCS.2019.00018","","https://ieeexplore.ieee.org/stamp/stamp.jsp?arnumber=https://ieeexplore.ieee.org/document/8885186","Relaxed Loop Freedom;Tight Lower Bound;Software Defined Networks","Schedules;Protocols;Transient analysis;Software;Acceleration;Routing;Delays","protocols;software defined networking;switching networks","SDNs;transient forwarding loop;Software Defined Networks;node-ordering protocol;loop-freedom - relaxed loop-freedom;relaxed loop-free constraint;relaxed loop-free update problem;fast relaxed loop-free update algorithm;tight lower bound","","","","","","","","IEEE","IEEE Conferences"
"Hermes: Improving Server Utilization by Colocation-Aware Runtime Systems","S. Liu; K. Li; H. Huang","Nanjing University; Nanjing University; Nanjing University","2019 IEEE 21st International Conference on High Performance Computing and Communications; IEEE 17th International Conference on Smart City; IEEE 5th International Conference on Data Science and Systems (HPCC/SmartCity/DSS)","","2019","","","901","910","","","","10.1109/HPCC/SmartCity/DSS.2019.00131","","https://ieeexplore.ieee.org/stamp/stamp.jsp?arnumber=https://ieeexplore.ieee.org/document/8855432","resource allocation, quality of service, scheduling","Runtime;Interference;Kernel;Servers;Instruction sets;Resource management;Schedules","Linux;multiprocessing systems;multi-threading;power aware computing;resource allocation;scheduling","Hermes;server utilization;colocation-aware runtime systems;latency-critical service;strict tail latency service-level objects;safe colocation;server resources;user-level resource management layer;latency-critical workload;best-effort workloads;BE runtime;LC runtime implements user-level thread management;server utlization","","","","","","","","IEEE","IEEE Conferences"
"A Queueing Analysis of the Opportunistic Vehicle-to-Vehicle Communication","W. Xu; S. Guo; H. Zhou; S. Ma; M. Wu","The Hong Kong Polytechnic University; The Hong Kong Polytechnic University; Nanjing University; The Hong Kong Polytechnic University; The Hong Kong Polytechnic University","2019 IEEE Global Communications Conference (GLOBECOM)","","2019","","","1","6","","","","10.1109/GLOBECOM38437.2019.9014170","","https://ieeexplore.ieee.org/stamp/stamp.jsp?arnumber=https://ieeexplore.ieee.org/document/9014170","","Task analysis;Vehicular ad hoc networks;Data models;Queueing analysis;Delays;Servers;Analytical models","","","","","","","","","","IEEE","IEEE Conferences"
"A Logic Pattern of Agents with Emotional Attitudes","C. Liu; Z. Zhang; Y. Yao; Y. Xu","Nanjing University; Nanjing University; Nanjing University; Nanjing University","2019 6th International Conference on Dependable Systems and Their Applications (DSA)","","2020","","","304","310","","","","10.1109/DSA.2019.00046","","https://ieeexplore.ieee.org/stamp/stamp.jsp?arnumber=https://ieeexplore.ieee.org/document/9045839","emotional attitudes;RDEU theory;logic pattern","","","","","","","","","","","IEEE","IEEE Conferences"
"Secure Beamforming Design for MISO SWIPT Systems: An Indirectly Optimized Approach","Y. Yu; S. Wang; S. Liu; L. Guo; Z. Ning; S. Gong; M. S. Obaidat","Northeastern University; Northeastern University; Northeastern University; Chongqing University of Posts and Telecommunications; Nanjing University; Sun Yat-sen University; Nazarbayev University","2019 IEEE Global Communications Conference (GLOBECOM)","","2019","","","1","6","","","","10.1109/GLOBECOM38437.2019.9013770","","https://ieeexplore.ieee.org/stamp/stamp.jsp?arnumber=https://ieeexplore.ieee.org/document/9013770","","Receivers;Interference;Signal to noise ratio;Transmitters;Optimization;Security;Communication system security","","","","","","","","","","IEEE","IEEE Conferences"
"Improve Downlink Rates of FDD Massive MIMO Systems by Exploiting CSI Feedback Waiting Phase","Z. Tao; T. Wang; S. Wang","Nanjing University; Nanjing University; Nanjing University","2019 IEEE Global Communications Conference (GLOBECOM)","","2019","","","1","6","","","","10.1109/GLOBECOM38437.2019.9014265","","https://ieeexplore.ieee.org/stamp/stamp.jsp?arnumber=https://ieeexplore.ieee.org/document/9014265","","Downlink;MIMO communication;Precoding;Uplink;Training;Mobile communication;Interference","","","","","","","","","","IEEE","IEEE Conferences"
"Providing bandwidth guarantees, work conservation and low latency simultaneously in the cloud","S. Hu; W. Bai; K. Chen; C. Tian; Y. Zhang; H. Wu","SING Group @ HKUST; SING Group @ HKUST; SING Group @ HKUST; Nanjing University; HP Labs; Microsoft","IEEE INFOCOM 2016 - The 35th Annual IEEE International Conference on Computer Communications","","2016","","","1","9","","","","10.1109/INFOCOM.2016.7524341","","https://ieeexplore.ieee.org/stamp/stamp.jsp?arnumber=https://ieeexplore.ieee.org/document/7524341","","Bandwidth;Probes;Hardware;Delays;Interference;Control systems;Servers","bandwidth allocation;cloud computing;computer centres","bandwidth guarantees;work conservation;low latency;cloud;multi-tenant datacenter network infrastructure;throughput-intensive applications;latency-sensitive short messages;Trinity","","16","","","","","","IEEE","IEEE Conferences"
"Understanding Exception-Related Bugs in Large-Scale Cloud Systems","H. Chen; W. Dou; Y. Jiang; F. Qin","The Ohio State University; Chinese Academy of Sciences; Nanjing University; The Ohio State University","2019 34th IEEE/ACM International Conference on Automated Software Engineering (ASE)","","2019","","","339","351","","","","10.1109/ASE.2019.00040","","https://ieeexplore.ieee.org/stamp/stamp.jsp?arnumber=https://ieeexplore.ieee.org/document/8952179","exception handling;cloud system;empirical study","","cloud computing;error handling;program debugging;program diagnostics;public domain software","exception-related bugs;large-scale cloud systems;exception mechanism;system downtime;eBugs;DIET;static analysis tool;error handling code","","1","","","","","","IEEE","IEEE Conferences"
"Learned Quality Enhancement via Multi-Frame Priors for HEVC Compliant Low-Delay Applications","M. Lu; M. Cheng; Y. Xu; S. Pu; Q. Shen; Z. Ma","Nanjing University; Shanghai Jiao Tong University; Shanghai Jiao Tong University; Hikvision Research Institute; Nanjing University; Nanjing University","2019 IEEE International Conference on Image Processing (ICIP)","","2019","","","934","938","","","","10.1109/ICIP.2019.8803049","","https://ieeexplore.ieee.org/stamp/stamp.jsp?arnumber=https://ieeexplore.ieee.org/document/8803049","Video quality enhancement;multi-scale spatial priors;multi-frame temporal priors;post-processing;HEVC","Convolutional codes;Xenon;Gain;Training;Optical fiber networks;Cats;Visualization","convolutional neural nets;data compression;learning (artificial intelligence);video coding","multiframe priors;HEVC compliant low-delay applications;video conferencing;visual quality;unexpected network fluctuation;limited bandwidth;Quality Enhancement Network;QENet;video compression artifacts;spatial priors;temporal priors;respective multiscale convolutions;temporal predictions;stand-alone post-processing subsystem;deep learning;high-efficiency video coding compliant decoder","","","","","","","","IEEE","IEEE Conferences"
"CFADefense: A Security Solution to Detect and Mitigate Crossfire Attacks in Software-Defined IoT-Edge Infrastructure","W. Rafique; X. He; Z. Liu; Y. Sun; W. Dou","Nanjing University; Nanjing University; Nanjing University; Nanjing University; Nanjing University","2019 IEEE 21st International Conference on High Performance Computing and Communications; IEEE 17th International Conference on Smart City; IEEE 5th International Conference on Data Science and Systems (HPCC/SmartCity/DSS)","","2019","","","500","509","","","","10.1109/HPCC/SmartCity/DSS.2019.00080","","https://ieeexplore.ieee.org/stamp/stamp.jsp?arnumber=https://ieeexplore.ieee.org/document/8855406","Edge computing;IoT;crossfire attack;SDN;policy consistency;waypoint enforcement","Internet of Things;Computer crime;Servers;Inspection;Control systems;Computer architecture","computer network management;computer network security;Internet of Things;software defined networking;telecommunication network routing;telecommunication traffic","network infrastructure management;numerous recent studies;policy consistency;high-level network requirements;SDN infrastructure;low-rate legitimate traffic;data plane devices;security anomalies;routing inconsistencies;policy switch attacks;CFADefense;attack detection;software-defined IoT-edge infrastructure;software-defined networking;IoT networks;distributed denial of service attacks;DDoS attack;crossfire attacks;Internet of Things infrastructure;waypoint enforcement;open-source Floodlight controller","","","","","","","","IEEE","IEEE Conferences"
"A Deep Learning Method for Judicial Decision Support","B. Chen; Y. Li; S. Zhang; H. Lian; T. He","Information Center of The Supreme People's Court of The People's Republic of China; Nanjing University; Nanjing University; Nanjing University; Nanjing University","2019 IEEE 19th International Conference on Software Quality, Reliability and Security Companion (QRS-C)","","2019","","","145","149","","","","10.1109/QRS-C.2019.00040","","https://ieeexplore.ieee.org/stamp/stamp.jsp?arnumber=https://ieeexplore.ieee.org/document/8859445","Intelligent court;Judicial data analysis;Text Categorization;FastText;TextCNN","Law;Predictive models;Deep learning;Data models;Prediction algorithms;Feature extraction","decision support systems;law administration;learning (artificial intelligence)","judicial decision support;deep learning technology;deep learning model;machine learning innovation;deep learning method;legal provisions;nonlegal professionals","","","","","","","","IEEE","IEEE Conferences"
"BENU: Distributed Subgraph Enumeration with Backtracking-Based Framework","Z. Wang; R. Gu; W. Hu; C. Yuan; Y. Huang","Nanjing University; Nanjing University; Nanjing University; Nanjing University; Nanjing University","2019 IEEE 35th International Conference on Data Engineering (ICDE)","","2019","","","136","147","","","","10.1109/ICDE.2019.00021","","https://ieeexplore.ieee.org/stamp/stamp.jsp?arnumber=https://ieeexplore.ieee.org/document/8731551","subgraph isomorphism;subgraph matching;task parallel;backtracking","Distributed databases;Task analysis;Pattern matching;Indexes;Distributed algorithms;Scalability","computational complexity;distributed algorithms;distributed databases;graph theory","distributed subgraph enumeration;pattern graph;data graph;subgraphs;partial matching results;backtracking-based framework BENU;subgraph enumeration task;backtracking-based execution plan;distributed algorithms;inter-task locality;intra-task locality","","","","","","","","IEEE","IEEE Conferences"
"Fast-ABC: A Fast Architecture for Bottleneck-Like Based Convolutional Neural Networks","X. Xie; F. Sun; J. Lin; Z. Wang","Nanjing University; Nanjing University; Nanjing University; Nanjing University","2019 IEEE Computer Society Annual Symposium on VLSI (ISVLSI)","","2019","","","1","6","","","","10.1109/ISVLSI.2019.00010","","https://ieeexplore.ieee.org/stamp/stamp.jsp?arnumber=https://ieeexplore.ieee.org/document/8839351","Convolutional neural networks (CNNs);Bottleneck-like operator;FPGA;Winograd","","convolutional neural nets;field programmable gate arrays;logic design","computational complexity;Fast-ABC;light weight networks;bottleneck-like operations;resource utilization;partial fusion strategy;Winograd algorithm;fast architecture for bottleneck-like based convolutional neural networks","","","","","","","","IEEE","IEEE Conferences"
"WaaS: Wisdom as a Service","J. Chen; J. Ma; N. Zhong; Y. Yao; J. Liu; R. Huang; W. Li; Z. Huang; Y. Gao; J. Cao","Tsinghua University; Hosei University; Maebashi Institute of Technology and Beijing University of Technology; University of Regina; Hong Kong Baptist University; Hosei University; Shijiazhuang University of Economics; Vrije University Amsterdam; Nanjing University; National University of Defense Technology","IEEE Intelligent Systems","","2014","29","6","40","47","","","","10.1109/MIS.2014.19","","https://ieeexplore.ieee.org/stamp/stamp.jsp?arnumber=https://ieeexplore.ieee.org/document/6813392","WaaS;W2T cycle;IoT;WoT;Big Data;hyper-world;cloud computing;intelligent systems","Social implications of technology;Social factors;Computer architecture;Internet;Information management;Man machine interaction;Data storage systems","Big Data;cloud computing;human computer interaction;Internet of Things;knowledge based systems;open systems","wisdom as a service;social-cyber-physical space;Wisdom Web of Things cycle;W2T cycle;harmonious symbiosis;intelligent information technology application;open architecture;interoperable architecture;cloud computing;Internet of Things;Big Data;open system architecture;resource sharing;resource services;open content architecture;interoperable content architecture;intelligent sharing and services;data information knowledge and wisdom hierarchy;DIKW hierarchy;pay-as-you-go IT trend;WaaS infrastructure;WaaS research;ubiquitous intelligent IT application","","24","","","09 May 2014","","","IEEE","IEEE Conferences"
