"Nearest Neighbor Ensembles: An Effective Method for Difficult Problems in Streaming Classification with Emerging New Classes","X. Cai; P. Zhao; K. Ting; X. Mu; Y. Jiang","Nanjing University; Nanjing University; Federation University, Australia; Nanjing University; Nanjing University","2019 IEEE International Conference on Data Mining (ICDM)","","2019","","","970","975","","","","10.1109/ICDM.2019.00109","","https://ieeexplore.ieee.org/stamp/stamp.jsp?arnumber=https://ieeexplore.ieee.org/document/8970887","classification;data stream;new class;ensemble method;open and dynamic environments","","feature extraction;learning (artificial intelligence);pattern classification","feature space;class separation indicator alpha;nearest neighbor ensembles;high-alpha SENC problems;single data stream;streaming classification with emerging new classes;low-alpha SENC problems","","","","","","","","IEEE","IEEE Conferences"
"LESDroid - A Tool for Detecting Exported Service Leaks of Android Applications","J. MA; S. LIU; Y. JIANG; X. TAO; C. XU; J. LU","Nanjing University; Nanjing University; Nanjing University; Nanjing University; Nanjing University; Nanjing University","2018 IEEE/ACM 26th International Conference on Program Comprehension (ICPC)","","2018","","","244","24410","","","","","","https://ieeexplore.ieee.org/stamp/stamp.jsp?arnumber=https://ieeexplore.ieee.org/document/8973096","Android;testing;memory leak;vulnerability;service","","Android (operating system);mobile computing;security of data;smart phones","LESDroid;Android applications;Android apps;malicious external apps;exported service leaks detection;service instances;service leak detection;leak entries","","","","","","","","IEEE","IEEE Conferences"
"SGUARD: A Feature-Based Clustering Tool for Effective Spreadsheet Defect Detection","D. Li; H. Wang; C. Xu; R. Zhang; S. Cheung; X. Ma","Nanjing University; Nanjing University; Nanjing University; Microsoft, China; The Hong Kong University of Sci. and Tech.; Nanjing University","2019 34th IEEE/ACM International Conference on Automated Software Engineering (ASE)","","2019","","","1142","1145","","","","10.1109/ASE.2019.00122","","https://ieeexplore.ieee.org/stamp/stamp.jsp?arnumber=https://ieeexplore.ieee.org/document/8952240","Cell clustering;Defect detection","","pattern clustering;security of data;spreadsheet programs","SGuard implementation;effective spreadsheet defect detection;spreadsheet features;cluster cells;anomalous cells;computational semantics","","","","","","","","IEEE","IEEE Conferences"
"Bundle protocol for data delivery over highly asymmetric deep-space channels","Z. Bian; R. Wang; K. Zhao; D. Bian; Z. Xie; Y. Qian","PLA University of Science and Technology; Lamar University and Nanjing University; Nanjing University; PLA University of Science and Technology; PLA University of Science and Technology; University of Nebraska-Lincoln","IEEE Network","","2016","30","5","68","73","","","","10.1109/MNET.2016.7579029","","https://ieeexplore.ieee.org/stamp/stamp.jsp?arnumber=https://ieeexplore.ieee.org/document/7579029","","Protocols;Delays;Convergence;Reliability;Propagation delay;Tolerance analysis;Fault tolerant systems","delay tolerant networks;peer-to-peer computing;protocols;relay networks (telecommunication);space communication links","delay-disruption-tolerant networking;store-and-forward mechanism;custody transfer option;file delivery services;stressed communications environment;deep-space communication environment;signal propagation delay;bundle protocol transmission;file transfer operation;relay-based deep-space communication infrastructure;highly asymmetric channel rates;optimal bundle protocol bundle size","","2","","","","","","IEEE","IEEE Conferences"
"Cloud Database Encryption Technology Based on Combinatorial Encryption","M. Chen; X. Fu; B. Luo; X. Du; M. Guizani","Nanjing University; Nanjing University; Nanjing University; Temple University; Qatar University","2019 IEEE Global Communications Conference (GLOBECOM)","","2019","","","1","5","","","","10.1109/GLOBECOM38437.2019.9013204","","https://ieeexplore.ieee.org/stamp/stamp.jsp?arnumber=https://ieeexplore.ieee.org/document/9013204","","Encryption;Databases;Cloud computing;Servers;Ciphers","","","","","","","","","","IEEE","IEEE Conferences"
"A Novel Structure of Microfiber-Based Sensor for Onsite/in-Situ Detection of Heavy Metal Ions","X. Zhang; W. Ji; S. Yap Hui Kit; G. Wang; Y. Zhang; K. T. Yong; S. C. Tjin","Nanjing University; Nanjing University; Nanyang Technological University; Nanjing University; Nanjing University; Nanyang Technological University; Nanyang Technological University","2018 Conference on Lasers and Electro-Optics Pacific Rim (CLEO-PR)","","2018","","","1","2","","","","","","https://ieeexplore.ieee.org/stamp/stamp.jsp?arnumber=https://ieeexplore.ieee.org/document/8699818","","Metals;Ions;Optical fiber sensors;Fiber gratings;Optical fibers","Bragg gratings;chemical sensors;fibre optic sensors;micro-optics;microsensors","microfiber-based sensor;heavy metal ions;sensing structure;nonadiabatic microfiber;onsite-in-situ detection;fiber Bragg gratings;chelating agent","","","","","","","","IEEE","IEEE Conferences"
"Quality Driven Judicial Data Governance","T. He; S. Chen; L. Hao; J. Liu","Nanjing University; Nanjing University; Nanjing University; Nanjing University","2019 IEEE 19th International Conference on Software Quality, Reliability and Security Companion (QRS-C)","","2019","","","66","70","","","","10.1109/QRS-C.2019.00026","","https://ieeexplore.ieee.org/stamp/stamp.jsp?arnumber=https://ieeexplore.ieee.org/document/8859426","data quality;judicial data governance;quality measurement","Data integrity;Big Data;Decision making;Organizations;Standards organizations","business data processing;data analysis;government data processing;law;trademarks","data assets;data quality control;data service development;judicial business data;data governance method;judicial data governance;Smart Court 3.0;data governance system;judicial data quality measurement","","","","","","","","IEEE","IEEE Conferences"
"LIP: Local Importance-Based Pooling","Z. Gao; L. Wang; G. Wu","Nanjing University; Nanjing University; Nanjing University","2019 IEEE/CVF International Conference on Computer Vision (ICCV)","","2019","","","3354","3363","","","","10.1109/ICCV.2019.00345","","https://ieeexplore.ieee.org/stamp/stamp.jsp?arnumber=https://ieeexplore.ieee.org/document/9010729","","Lips;Convolution;Task analysis;Clutter;Feature extraction;Aggregates;Neural networks","convolutional neural nets;image classification;importance sampling;learning (artificial intelligence)","local importance-based pooling;spatial downsampling layers;convolutional neural networks;downsampling layers;pooling layers;local importance modeling;discriminative features;downsampling procedure;adaptive importance weights;LIP-ResNets;CNN;ImageNet classification;MS COCO dataset","","","","","","","","IEEE","IEEE Conferences"
"Resource Reservation and Request Routing for a Cloud-Based Content Delivery Network","Q. Fan; Y. Jiang; H. Yin; Y. Lyu; H. Huang; X. Zhang","Chongqing University; Norwegian University of Science and Technology (NTNU); Tsinghua University; Tsinghua University; China University of Geosciences; Nanjing University","2019 IEEE International Conference on Service-Oriented System Engineering (SOSE)","","2019","","","281","2815","","","","10.1109/SOSE.2019.00048","","https://ieeexplore.ieee.org/stamp/stamp.jsp?arnumber=https://ieeexplore.ieee.org/document/8705926","content delivery network, resource reservation, request routing, cloud, heuristic algorithm","Data centers;Cloud computing;Optimization;Bandwidth;Routing;Servers;Linear programming","cloud computing;content management;optimisation;pricing;resource allocation;telecommunication traffic","cloud-based content delivery network;content delivery networks;promising content-distribution-as-a-service alternative;pay-as-you-go business model;cloud-based CDN;flexible cost-effective solution;geographical diversity;cloud resource prices;optimal resource reservation problem;cloud resources;trade-off between rental cost;user experience;request routing optimization problem;user requests","","1","","","","","","IEEE","IEEE Conferences"
"Research on Government Information Sharing Model Using Blockchain Technology","Y. Zhang; S. Deng; Y. Zhang; J. Kong","Nanjing University; Nanjing University; Nanjing University; Nanjing University","2019 10th International Conference on Information Technology in Medicine and Education (ITME)","","2019","","","726","729","","","","10.1109/ITME.2019.00166","","https://ieeexplore.ieee.org/stamp/stamp.jsp?arnumber=https://ieeexplore.ieee.org/document/8964638","Blockchain, Government Information Sharing, E-government, Barn Effect","Blockchain;Information management;Security;Electronic government;Information services;Data engineering","cryptography;government data processing;information management;information resources","government information sharing model;blockchain technology;government information resource models;government affairs;service-oriented e-government;government information management;blockchain-based solution;information interaction analysis;Chinese government;information sharing solution","","","","","","","","IEEE","IEEE Conferences"
"A Gaming Decision Framework Based on Prospect Theory and Synthetized Weighting Method under Emergency","W. Zhou","Nanjing University","2019 International Conference on Machine Learning, Big Data and Business Intelligence (MLBDBI)","","2019","","","23","31","","","","10.1109/MLBDBI48998.2019.00013","","https://ieeexplore.ieee.org/stamp/stamp.jsp?arnumber=https://ieeexplore.ieee.org/document/8945653","prospect theory;game theory;synthetized weighting;emergency decision method","","decision making;emergency management;game theory;psychology","decision-making process;comprehensive weighting method;prospect value;emergency events;decision maker;game theory;helpful decision framework;rescuing recovering work;emergency decision making;social transformation;comprehensive economic transformation;rapid advancement;synthetized weighting method;prospect theory;gaming decision framework","","","","","","","","IEEE","IEEE Conferences"
"ParaAim: Testing Android Applications Parallel at Activity Granularity","C. Cao; J. Deng; P. Yu; Z. Duan; X. Ma","Nanjing University; Nanjing University; Nanjing University; Shenzhen Feixiang Software Consulting Co., Ltd; Nanjing University","2019 IEEE 43rd Annual Computer Software and Applications Conference (COMPSAC)","","2019","1","","81","90","","","","10.1109/COMPSAC.2019.00021","","https://ieeexplore.ieee.org/stamp/stamp.jsp?arnumber=https://ieeexplore.ieee.org/document/8754259","Android Testing;Parallel Testing;Sequence Minimization;Widget Fuzzy Match","Task analysis;Testing;Tools;Graphical user interfaces;Minimization;Computational modeling;Software","Android (operating system);graphical user interfaces;mobile computing;parallel processing;program testing;smart phones","activity granularity;parallel computing;app testing job;parallel GUI exploration schema;Android device cluster;Android applications testing;ParaAim;parallel testing platform;entrance activity","","","","","","","","IEEE","IEEE Conferences"
"Enhancing Low Light Videos by Exploring High Sensitivity Camera Noise","W. Wang; X. Chen; C. Yang; X. Li; X. Hu; T. Yue","Nanjing University; Nanjing University; Nanjing University; Nanjing University; Nanjing University; Nanjing University","2019 IEEE/CVF International Conference on Computer Vision (ICCV)","","2019","","","4110","4118","","","","10.1109/ICCV.2019.00421","","https://ieeexplore.ieee.org/stamp/stamp.jsp?arnumber=https://ieeexplore.ieee.org/document/9011000","","Videos;Cameras;Sensitivity;Colored noise;Image color analysis;Gaussian distribution","cameras;image capture;image denoising;image enhancement;recurrent neural nets;video signal processing","digital cameras;practical high sensitivity noise;mixture noises;high quality videos;high sensitivity camera setting;low light condition;brightness adjustment;denoising adjustment;high sensitivity camera noise;enhancing low light videos;real captured low light videos;synthetic captured low light videos;clear-bright video;dark noisy video;noise model","","","","","","","","IEEE","IEEE Conferences"
"Looking Into Online Gaming From Measurement Perspective","K. Yang; X. Zhang; Y. Zhao; Q. Fan; Q. Gao; Y. Lyu; H. Yin; Z. Ma","Nanjing University; Nanjing University; Nanjing University; Chongqing University; Tsinghua University; Tsinghua University; Tsinghua University; Nanjing University","2019 IEEE International Conference on Service-Oriented System Engineering (SOSE)","","2019","","","203","2035","","","","10.1109/SOSE.2019.00035","","https://ieeexplore.ieee.org/stamp/stamp.jsp?arnumber=https://ieeexplore.ieee.org/document/8705884","online game, network measurement, measuring methods","Games;Computer architecture;Servers;Quality of experience;Protocols;Cloud computing","computer games;Internet;quality of experience","online gaming;game competitiveness enhancement;game deployment;online game measurements;game system design;quality of experience","","","","","","","","IEEE","IEEE Conferences"
"A Novel Unsupervised Camera-Aware Domain Adaptation Framework for Person Re-Identification","L. Qi; L. Wang; J. Huo; L. Zhou; Y. Shi; Y. Gao","Nanjing University; University of Wollongong. Australia; Nanjing University; University of Sydney; Nanjing University; Nanjing University","2019 IEEE/CVF International Conference on Computer Vision (ICCV)","","2019","","","8079","8088","","","","10.1109/ICCV.2019.00817","","https://ieeexplore.ieee.org/stamp/stamp.jsp?arnumber=https://ieeexplore.ieee.org/document/9008837","","Cameras;Training;Task analysis;Optimization;Generators;Benchmark testing;Image resolution","cameras;face recognition;image representation;unsupervised learning","discriminative information;representation learning;end-to-end deep domain adaptation framework;person Re-ID;camera-aware domain adaptation method;adversarial learning;target domains;data distribution discrepancy;unsupervised cross-domain person reidentification;unsupervised camera-aware domain adaptation framework;camera-level subdomains","","1","","","","","","IEEE","IEEE Conferences"
"PANet: A Context Based Predicate Association Network for Scene Graph Generation","Y. Chen; Y. Wang; Y. Zhang; Y. Guo","Nanjing University; Zhejiang University; Nanjing University; Nanjing University; The 28th Research Institute of China Electronics Technology Group Corporation, China","2019 IEEE International Conference on Multimedia and Expo (ICME)","","2019","","","508","513","","","","10.1109/ICME.2019.00094","","https://ieeexplore.ieee.org/stamp/stamp.jsp?arnumber=https://ieeexplore.ieee.org/document/8784780","Scene graph, context, predicate association, attention mechanism, recurrent neural network","Feature extraction;Visualization;Context modeling;Task analysis;Computational modeling;Recurrent neural networks;Semantics","biology computing;genomics;graph theory;image classification;recurrent neural nets","PANet;scene graph generation;two-stage framework;model predicate association;scene-level context;object classification;recurrent neural network;context based predicate association network;visual genome dataset","","","","","","","","IEEE","IEEE Conferences"
"Optimal Energy Allocation and Multiuser Scheduling in SWIPT Systems with Hybrid Power Supply","D. Guo; L. Tang; X. Zhang","Nanjing University; Nanjing University; Nanjing University","2019 IEEE Globecom Workshops (GC Wkshps)","","2019","","","1","6","","","","10.1109/GCWkshps45667.2019.9024326","","https://ieeexplore.ieee.org/stamp/stamp.jsp?arnumber=https://ieeexplore.ieee.org/document/9024326","","Batteries;Resource management;Wireless communication;Throughput;Markov processes;Optimization;Radio frequency","","","","","","","","","","IEEE","IEEE Conferences"
"In Method We Trust: Towards an Open Method Kit for Characterizing Spot Cloud Service Pricing","Z. Li; X. Li; B. Li","University of Concepción; Nanjing University; Nanjing University","2019 IEEE 12th International Conference on Cloud Computing (CLOUD)","","2019","","","470","474","","","","10.1109/CLOUD.2019.00081","","https://ieeexplore.ieee.org/stamp/stamp.jsp?arnumber=https://ieeexplore.ieee.org/document/8814518","Cloud Market;Open Method Kit;Spot Cloud Pricing;Spot Cloud Service","","cloud computing;pricing;Web services","distribution modeling analysis;central tendency analysis;consumer budget optimization;provider revenue maximization;spot cloud service pricing;open methods;domain-specific method kit;service procurement;market-driven mechanisms;open method kit","","","","","","","","IEEE","IEEE Conferences"
"Design of Key Space Based on CPRS Algorithm","D. Cai; X. Ji; W. Jin","Nanjing University; Nanjing University; Nanjing University","2017 International Conference on Network and Information Systems for Computers (ICNISC)","","2017","","","172","175","","","","10.1109/ICNISC.2017.00044","","https://ieeexplore.ieee.org/stamp/stamp.jsp?arnumber=https://ieeexplore.ieee.org/document/8842796","Key;Password;Hyperchaotic system;S - Box;Hash function","Password;Couplings;Distance measurement;Sensitivity;Encryption;Space vehicles","cryptography;number theory","key space;one-dimensional system;coupling coefficients;m-dimensional CPRS hyperchaotic system;S_Box algorithm;value distribution uniform;encryption system;initial values;BKDRHash function","","","","","","","","IEEE","IEEE Conferences"
"Thresholded Monitoring in Distributed Data Streams","M. Li; H. Dai; X. Wang; R. Xia; A. X. Liu; G. Chen","Nanjing University; Nanjing University; Nanjing University; Nanjing University; Nanjing University; Nanjing University","2019 IEEE 39th International Conference on Distributed Computing Systems (ICDCS)","","2019","","","218","227","","","","10.1109/ICDCS.2019.00030","","https://ieeexplore.ieee.org/stamp/stamp.jsp?arnumber=https://ieeexplore.ieee.org/document/8885013","Distributed data streams;Network monitoring;Sketch","Monitoring;Distributed databases;Encoding;Data structures;Data mining;Maximum likelihood decoding;Delays","data handling;deterministic algorithms;distributed processing;optimisation;query processing;storage management","distributed data streams;global frequencies overall data streams;high-threshold monitoring;low-threshold monitoring;Cuckoo Filter;thresholded monitoring;multiple sampling technique;transferring frequencies;H-CCF;L-CCF;frequency information","","1","","","","","","IEEE","IEEE Conferences"
"Differentially Private Auctions for Private Data Crowdsourcing","M. Shi; Y. Qiao; X. Wang","Zhengzhou University of Light Industry; Nanjing University; Peking University","2019 IEEE Intl Conf on Parallel & Distributed Processing with Applications, Big Data & Cloud Computing, Sustainable Computing & Communications, Social Computing & Networking (ISPA/BDCloud/SocialCom/SustainCom)","","2019","","","1","8","","","","10.1109/ISPA-BDCloud-SustainCom-SocialCom48970.2019.00013","","https://ieeexplore.ieee.org/stamp/stamp.jsp?arnumber=https://ieeexplore.ieee.org/document/9047483","game theory;crowdsourcing;private","","","","","","","","","","","IEEE","IEEE Conferences"
"Energy-Efficient Computation Offloading with Privacy Preservation for Edge Computing-Enabled 5G Networks","X. Liu; X. Xu; Y. Yuan; X. Zhang; W. Dou","Nanjing University of Information Science and Technology; Nanjing University of Information Science and Technology; Michigan State University; University of Auckland; Nanjing University","2019 International Conference on Internet of Things (iThings) and IEEE Green Computing and Communications (GreenCom) and IEEE Cyber, Physical and Social Computing (CPSCom) and IEEE Smart Data (SmartData)","","2019","","","176","181","","","","10.1109/iThings/GreenCom/CPSCom/SmartData.2019.00050","","https://ieeexplore.ieee.org/stamp/stamp.jsp?arnumber=https://ieeexplore.ieee.org/document/8875401","edge computing;edge nodes;5G;load balance;energy consumption","Task analysis;Energy consumption;5G mobile communication;Mobile handsets;Privacy;Biological cells;Computational modeling","5G mobile communication;cloud computing;data privacy;mobile computing","privacy preservation;edge computing-enabled 5G networks;mobile devices;computing power;nearby edge nodes;EN;load balance;energy consumption;energy-efficient computation offloading method","","","","","","","","IEEE","IEEE Conferences"
"An Associated Behavior Sequence Based User Authentication Approach in M2M Mobile Terminals","C. Shi; M. Du; W. Lu; S. Lu","Nanjing University, Global Energy Interconnection Research Institute Co. Ltd.; Nanjing University of Posts and Telecommunications; Nanjing University of Posts and Telecommunications; Nanjing University","2019 IEEE Global Communications Conference (GLOBECOM)","","2019","","","1","6","","","","10.1109/GLOBECOM38437.2019.9013998","","https://ieeexplore.ieee.org/stamp/stamp.jsp?arnumber=https://ieeexplore.ieee.org/document/9013998","","Authentication;Machine-to-machine communications;Correlation;Dynamic programming;Industries;Password","","","","","","","","","","IEEE","IEEE Conferences"
"Video Text Detection with Fully Convolutional Network and Tracking","Y. Wang; L. Wang; F. Su; J. Shi","Nanjing University; Nanjing University; Nanjing University; Nanjing University","2019 IEEE International Conference on Multimedia and Expo (ICME)","","2019","","","1738","1743","","","","10.1109/ICME.2019.00299","","https://ieeexplore.ieee.org/stamp/stamp.jsp?arnumber=https://ieeexplore.ieee.org/document/8784955","Scene text, video, detection, tracking, fully convolutional network","Feature extraction;Trajectory;Correlation;Semantics;Target tracking;Geometry;Training","convolutional neural nets;feature extraction;image filtering;image fusion;image resolution;object tracking;text detection;video signal processing","video text detection;rich semantic information;content-based video applications;effective fully convolutional network model;novel refine block structure;low-level features;high-level semantic features;high-resolution semantic feature maps;individual-frame detection;detection performance;public scene text video datasets;scene text;refine block structure;multiresolution feature extraction fusion;efficient correlation filter based text tracking mechanism","","","","","","","","IEEE","IEEE Conferences"
"DeepPath: Path-Driven Testing Criteria for Deep Neural Networks","D. Wang; Z. Wang; C. Fang; Y. Chen; Z. Chen","Nanjing University; Nanjing University of Posts and Telecommunications; Nanjing University; Nanjing University of Posts and Telecommunications; Nanjing University","2019 IEEE International Conference On Artificial Intelligence Testing (AITest)","","2019","","","119","120","","","","10.1109/AITest.2019.00013","","https://ieeexplore.ieee.org/stamp/stamp.jsp?arnumber=https://ieeexplore.ieee.org/document/8718217","deep neural networks, testing criteria, path coverage","Neurons;Testing;Biological neural networks;Deep learning;Peer-to-peer computing;Data models;Software","neural nets;program testing;security of data","path-driven testing criteria;deep neural networks;path-oriented testing;test adequacy;adversarial attack test inputs;DeepPath;DNN models","","","","","","","","IEEE","IEEE Conferences"
"NeuralVis: Visualizing and Interpreting Deep Learning Models","X. Zhang; Z. Yin; Y. Feng; Q. Shi; J. Liu; Z. Chen","Nanjing University; Nanjing University; Nanjing University; Nanjing University; Nanjing University; Nanjing University","2019 34th IEEE/ACM International Conference on Automated Software Engineering (ASE)","","2019","","","1106","1109","","","","10.1109/ASE.2019.00113","","https://ieeexplore.ieee.org/stamp/stamp.jsp?arnumber=https://ieeexplore.ieee.org/document/8952427","Visualization;Neural Network Visualization;Program Comprehension","","data visualisation;learning (artificial intelligence);neural nets;software engineering","NeuralVis;deep neural network techniques;software engineering tasks;software applications;rich data-driven programming paradigm;neurons;internal system logic;software engineers;instance-based visualization tool;data transformation process;task-based user study;classic DNN models;deep learning model visualization;deep learning model interpretation","","","","","","","","IEEE","IEEE Conferences"
"Diagnosing Energy Efficiency and Performance for Mobile Internetware Applications","Y. Liu; C. Xu; S. Cheung","The Hong Kong University of Science and Technology; Nanjing University; The Hong Kong University of Science and Technology","IEEE Software","","2015","32","1","67","75","","","","10.1109/MS.2015.4","","https://ieeexplore.ieee.org/stamp/stamp.jsp?arnumber=https://ieeexplore.ieee.org/document/7030255","smartphone applications;energy efficiency;performance bugs;automated diagnosis;Android;Internet;Internetware;software engineering","Computer bugs;Global Positioning System;Sensors;Smart phones;Batteries;Graphical user interfaces;Software engineering;Internet;Androids;Energy efficiency","energy conservation;Internet;mobile computing;program debugging;smart phones","energy efficiency diagnosis;performance bugs;mobile Internetware applications;smartphone application smart services;Internet-based mobile computing;bug characteristics;commercial Android applications;Samsung Mobile Software Developer Kit","","16","","","","","","IEEE","IEEE Conferences"
